claimReviewed,itemReviewed.author.name,itemReviewed.datePublished,datePublished,reviewRating.alternateName,language,domain,converted_label
“Cellule di Feto Abortito per Creare Aromi Alimentari”,,2021-02-27,2022-10-18 00:00:00,notizia falsa,it,facta.news,false
"«I porti italiani, finché sono ministro, erano, sono e rimarranno chiusi»

«I porti italiani, finché sono ministro, erano, sono e rimarranno chiusi»

«I porti italiani, finché sono ministro, erano, sono e rimarranno chiusi»

«I porti italiani, finché sono ministro, erano, sono e rimarranno chiusi»",Matteo Salvini,2019-01-06,2019-01-08 00:00:00,panzana pazzesca,it,pagellapolitica.it,false
George Soros è stato arrestato in Philadelphia per «interferenza elettorale»,,2020-11-23,2020-11-24 00:00:00,notizia falsa,it,facta.news,false
Il tuo indirizzo mail è stato selezionato tra i 55.000 iscritti a questa newsletter per vincere adesso un buono spesa di 1000 euro per la Conad,,2020-06-08,2020-06-08 00:00:00,notizia falsa,it,facta.news,false
"Al 20 agosto 2022 i dati ufficiali Eudravigilance mostrano 2.003.930 segnalazioni di effetti avversi, di cui 51.100 decessi.",,2022-10-30,2022-11-14 00:00:00,notizia falsa,it,facta.news,false
Secondo un sondaggio di SWG del 3 maggio la Lega sarebbe al 20%,,2020-05-03,2020-05-04 00:00:00,notizia falsa,it,facta.news,false
La dottoressa Patricia Montenegro ci dice che i vaccini sono un grande inganno.,Social media,2022-01-18,2022-01-21 00:00:00,falso,it,bufale.net,false
"Stanno inviando alcune foto del terremoto in Marocco tramite Whatsapp. Il file si chiama CARD Onde Sismiche, non apritelo e non guardatelo, vi hackera il telefono in 10 secondi e non può essere fermato in nessun modo. Fate girare!!!! NON APRIRLO",,2023-09-13,2023-09-13 00:00:00,notizia falsa,it,facta.news,false
La sperimentazione clinica del vaccino a mRna ha ucciso 20 mila macachi,,2021-07-20,2021-07-20 00:00:00,notizia falsa,it,facta.news,false
La foto mostra Joe Biden mentre dà un bacio a una bambina,,2020-06-09,2020-06-26 00:00:00,notizia falsa,it,facta.news,false
il Ceo di Walt Disney è stato arrestato «per traffico di esseri umani»,,2022-03-18,2022-03-23 00:00:00,notizia falsa,it,facta.news,false
Secondo un sondaggio 11 milioni di tedeschi combatterebbero per la Russia contro la Nato,,2022-05-09,2022-08-03 00:00:00,notizia falsa,it,facta.news,false
Ragazza norvegese di 22 anni aggredita e picchiata da un migrante iracheno per aver rifiutato le sue avances,,2022-08-09,2022-08-29 00:00:00,notizia falsa,it,facta.news,false
"Fabio Lucioni: «Dopo il mio goal di ieri ho provato emozioni forti, indescrivibili. Non solo per la mia fede romanista o per l'importanza della vittoria in chiave salvezza, ma soprattutto per la spocchia dei laziali. Dopo il vantaggio di Caicedo, Immobile si è avvicinato ad Acerbi esclamando ""anvedi questo con i piedi è peggio di Patric e Radu"" stava deridendo il nostro portiere (Gabriel n.d.r.), peccato che a fine partita sia stato lui a ridere di loro, la sua faccia da ebete dopo i miracoli di Gabriel su Adelkanye e Milinkovic non ha prezzo. Gli abbiamo concesso anche un occasione a porta vuota nel secondo tempo ma ovviamente ha dovuto fare il pallonetto, il fenomeno, classico quando ti senti una Lamborghini ma in realtà sei una Fiat Panda. La Lazio ci ha sottovalutato e mancato di rispetto, in campo stavano litigando tra di loro e ho sentito Patric dire ""Io ho giocato nel Barcelona, non posso perdere contro una squadra che non sta nemmeno sulla cartina"" , gli ho subito risposto, da buon romanista, che loro contro le squadre giallorosse perdono spesso e volentieri. Da lì si è scazzato e ha iniziato a picchiare come un fabbro, credo avesse il ciclo. E infatti poi ha morso Leonardo(Donati n.d.r.). È stato un gesto incommentabile: noi abbiamo fame di vittorie, non di avversari»",,2020-06-30,2020-07-09 00:00:00,notizia satirica,it,facta.news,false
"«La cosiddetta donna di 90 anni del Regno Unito che ha ricevuto il primo vaccino è in realtà un'attrice elitaria degli Illuminati vista in precedenti proteste di fake news mentre veniva aggredita dalla polizia. In effetti, ha appena 70 anni, meno di quanto riportato dai notiziari tradizionali quanto più di 90 anni»",,2020-12-09,2020-12-10 00:00:00,notizia falsa,it,facta.news,false
"Henry Kissinger: «Una volta che la massa accetta la vaccinazione obbligatoria forzata, il gioco è fatto! Accetteranno qualsiasi cosa - trasfusioni o donazioni di organi - per il “bene più grande”. Possiamo modificare geneticamente i bambini e sterilizzarli per il “bene più grande”. Controlla le menti delle pecore e controllerai il gregge. I produttori di vaccini possono guadagnare miliardi, e oggi molti di voi in questa sala sono investitori. È una grande vittoria! Sfoltiamo la massa, e la massa ci pagherà per fornire i servizi di sterminio»",,2022-09-22,2022-09-22 00:00:00,notizia falsa,it,facta.news,false
"Meta addebiterà a tutti gli utenti una cifra di 4,99 dollari al mese. Per evitare questo costo è necessario pubblicare una nota sul proprio profilo",,2023-11-11,2023-11-13 00:00:00,notizia falsa,it,facta.news,false
Le immagini delle «bare di Bergamo» trasmesse dai telegiornali erano false,,2020-07-03,2020-07-03 00:00:00,notizia falsa,it,facta.news,false
Al porto di Genova i manifestanti no-pass hanno bloccato tutto.,,2021-10-13,2021-10-13 00:00:00,falso,it,bufale.net,false
«Papa Francesco è morto».,,2021-07-05,2021-07-09 00:00:00,notizia falsa,it,facta.news,false
Christine Lagarde: «Gli anziani vivono troppo e sono pericolosi per l’economia mondiale»,,2020-08-10,2020-08-10 00:00:00,notizia falsa,it,facta.news,false
"No, una ricerca scientifica pubblicata su Science non dimostra che i dati sui contagi sono falsi",,2020-11-12,2020-11-12 00:00:00,notizia falsa,it,facta.news,false
Bill Gates arrestato dall'esercito americano ad agosto 2021,,2021-08-02,2021-08-04 00:00:00,notizia satirica,it,facta.news,false
«Chiamata ufficiale delle armi contro il popolo italiano»,,2020-10-23,2020-10-26 00:00:00,notizia falsa,it,facta.news,false
"Abimola, 36 anni, congolese pregiudicato, vive in un bilocale messo a disposizione dal comune in cui risiede. Riccardo, 78 anni, piemontese incensurato da due mesi vive in un parco perché lo stato gli ha pignorato la casa",,2020-07-27,2020-07-28 00:00:00,notizia falsa,it,facta.news,false
La foto di donna che a 54 anni ha partorito,,2020-06-19,2020-06-23 00:00:00,notizia falsa,it,facta.news,false
«La Pfizer scriver nero su bianco che si aspetta gravi affetti avversi a 6 mesi dopo la vaccinazione»,,2021-05-07,2021-05-10 00:00:00,notizia falsa,it,facta.news,false
Euronews ha dato la notizia di un’asta tedesca per distruggere le opere d’arte russe,,2022-10-27,2022-12-05 00:00:00,notizia falsa,it,facta.news,false
"Affermazione di Liz Truss: «Se la situazione mi richiederà di premere il pulsante nucleare, lo farò immediatamente. E non importa che moriranno milioni di cittadini, per me la cosa principale è la democrazia e i nostri ideali. I leader occidentali, per come la vediamo, sono pronti per una guerra nucleare e competono per vedere chi sarà il primo a ricevere l'onore di premere il pulsante».",,2022-09-06,2022-09-08 00:00:00,notizia falsa,it,facta.news,false
45.316 morti. 4.416.778 eventi avversi. Dati Ema-EudraVigilance al 7 giugno 2022. Informarsi per salvarsi,,2022-07-06,2022-07-07 00:00:00,notizia falsa,it,facta.news,false
"«Gli studi sui contagi nelle scuole ci sono, ma escludono che siano determinanti. Il Centro europeo per il controllo delle malattie ha detto chiaramente che le riaperture non hanno innescato la seconda ondata»

",Lucia Azzolina,2021-01-04,2021-01-04 00:00:00,nì,it,pagellapolitica.it,mixture
«Il Governo versa 50 milioni alla Tunisia per l’emergenza coronavirus»,Daniela Santanché,2020-03-27,2020-03-30 00:00:00,nì,it,pagellapolitica.it,mixture
Bere acqua fa male al pianeta,,2023-07-20,2023-07-20 00:00:00,notizia imprecisa,it,facta.news,mixture
"L’Italia è già in guerra, l’Esercito va alla nuova campagna di Russia",Contropiano,2022-03-15,2022-03-15 00:00:00,fuorviante,it,bufale.net,mixture
"«Per molti anni l’Italia aveva sospeso la vendita di armamenti verso il Cairo. Ha ripreso dal 2018, fino ad arrivare alla vendita delle due fregate Fremm di Fincantieri. Ma queste sono solo quelle più vistose, che fanno dell'Egitto il primo partner commerciale dell'Italia per la vendita di armamenti»

",Erasmo Palazzotto,2021-01-30,2021-02-01 00:00:00,nì,it,pagellapolitica.it,mixture
«Come si concilia l'enfasi sulle donne e i giovani con un Governo che ha contemporaneamente una scarsa presenza femminile e l'età media più alta dell'ultimo decennio?»,Giorgia Meloni,2021-02-18,2021-02-19 00:00:00,nì,it,pagellapolitica.it,mixture
"«La revoca [delle concessioni autostradali ad Autostrade per l’Italia n.d.r.] significherebbe una perdita secca di 20 miliardi»

",Giorgio Mulè,2020-07-14,2020-07-21 00:00:00,nì,it,pagellapolitica.it,mixture
"Da quando è in carica il Governo, si sono già persi 75 mila occupati: 350 posti di lavoro al giorno. In particolare, crollano i contratti a tempo indeterminato, mentre aumentano quelli precari, sta cioè fallendo l’obiettivo prioritario del cosiddetto ‘decreto dignità’",Nicola Zingaretti,2019-02-07,2019-02-11 00:00:00,nì,it,pagellapolitica.it,mixture
"La Lega vuole smontare la 194, peraltro fornendo dati falsi sugli aborti, visto che è noto a tutti che sono diminuiti negli anni",Alessia Morani,2019-03-25,2019-03-27 00:00:00,nì,it,pagellapolitica.it,mixture
"«Un tema, quello della #regolarizzazione e del superamento della #Bossi-Fini che era nell’accordo di governo, nel segno della discontinuità con il #ConteI»

",Riccardo Magi,2020-05-06,2020-05-07 00:00:00,nì,it,pagellapolitica.it,mixture
"La Commissione europea guidata da Jean-Claude Juncker costa ogni anno ai cittadini europei 510 milioni di euro [...], di cui 80 mila euro di alcol",Giorgia Meloni,2019-02-06,2019-02-06 00:00:00,nì,it,pagellapolitica.it,mixture
"Heineken ha comprato l’azienda Birra Messina appropriandosi del marchio, chiudendo lo stabilimento di Messina e licenziando tutti i dipendenti e trasferendo la produzione nello stabilimento di Massafra",,2023-08-26,2023-08-28 00:00:00,notizia imprecisa,it,facta.news,mixture
Una foto mostra una donna trasportare quello sembra un morto con una mano.,,2020-05-30,2020-06-01 00:00:00,notizia fuori contesto,it,facta.news,mixture
«L’anno scorso il Pil degli italiani sono stati un miliardo e 800 milioni di euro. La spesa pubblica sono 800 milioni di euro»,Matteo Salvini,2020-03-24,2020-03-25 00:00:00,nì,it,pagellapolitica.it,mixture
"«Ci sono due strade molto diverse che, in questo caso, distinguono molto bene conservatori e progressisti: i conservatori, la destra, hanno fatto i condoni fiscali [...] noi invece facciamo la lotta all’evasione fiscale. Sono due visioni diverse»",Roberto Gualtieri,2019-11-26,2019-11-28 00:00:00,nì,it,pagellapolitica.it,mixture
«Questo è uno dei lavoratori che la Bellanova vuole per la agricoltura .... Si sta allenando per la concimazione dei campi».,,2020-09-30,2020-10-01 00:00:00,notizia fuori contesto,it,facta.news,mixture
"Sono straordinariamente aumentate le esportazioni italiane verso il Canada, più otto per cento lo scorso anno e quasi più undici per cento quest’anno",Antonio Tajani,2019-01-21,2019-01-24 00:00:00,nì,it,pagellapolitica.it,mixture
Lo shock fiscale di Trump ha portato in 13 Stati della confederazione americana la disoccupazione sostanzialmente a tasso zero,Matteo Salvini,2019-05-27,2019-05-29 00:00:00,nì,it,pagellapolitica.it,mixture
"L'Iran manderà a morte TUTTI i manifestanti detenuti, e si tratta di circa 14mila persone. 227 deputati su 290 hanno chiesto una ""dura lezione"" per i manifestanti",,2022-11-08,2022-11-10 00:00:00,notizia imprecisa,it,facta.news,mixture
"«Covid, morto volontario test vaccino AstraZeneca in Brasile»",,2020-10-22,2020-10-22 00:00:00,notizia fuorviante,it,facta.news,mixture
"Da quando il Governo si è insediato, all’interno di una congiuntura negativa dell’Eurozona, la nostra economia non ha prodotto neanche un dato positivo",Renato Brunetta,2019-01-11,2019-01-15 00:00:00,nì,it,pagellapolitica.it,mixture
"Missile terra-aria russo fa inversione a ""U"" e si schianta contro le truppe che lo hanno lanciato",,2022-06-25,2022-07-05 00:00:00,notizia imprecisa,it,facta.news,mixture
"«La bozza del Recovery plan è già stata bocciata dall’Europa»
",Matteo Salvini,2021-01-26,2021-01-27 00:00:00,nì,it,pagellapolitica.it,mixture
"«La Germania farà un deficit di quasi 200 miliardi l’anno prossimo, noi stiamo discutendo fra manovra economica e decreti ristori, eccetera eccetera, di 50»

",Matteo Salvini,2020-11-23,2020-11-25 00:00:00,nì,it,pagellapolitica.it,mixture
"«Ho oltre il cinquanta per cento di presenze in aula durante i voti. Andate a controllare i tabulati. Quando conta ci sono sempre. Molto più di Salvini, ad esempio»",Matteo Renzi,2019-11-29,2019-11-29 00:00:00,nì,it,pagellapolitica.it,mixture
«Nel bilancio dell’Europa si tagliano 3 miliardi agli agricoltori italiani»,Matteo Salvini,2019-10-29,2019-10-30 00:00:00,nì,it,pagellapolitica.it,mixture
"«Chi continua a parlare di assenza di “condizionalità” mente sapendo di mentire»
",Dalila Nesci,2020-05-09,2020-05-12 00:00:00,nì,it,pagellapolitica.it,mixture
"«In Italia le morti per droga sono in impennata»

",Maria Teresa Bellucci,2021-01-26,2021-01-26 00:00:00,nì,it,pagellapolitica.it,mixture
«[Sull'istruzione] non ci saranno tagli vuol dire che rimangono i 4 miliardi di tagli in tre anni del governo precedente»,Carlo Calenda,2019-10-01,2019-10-02 00:00:00,nì,it,pagellapolitica.it,mixture
"JINGLE BELLS""...Con Il Natale nel [cuore] ed in allegria cantiamo tutti insieme La Canzone Natalizia tra le più celebri del Mondo, composta da James Lord Pierpont nell' Autunno del 1857, con il titolo ""One Horse Open Sleigh"", registrata da molti artisti di calibro come Louis Armstrong, Frank Sinatra, Luciano Pavarotti, Nini Rosso, ed altri cantanti e band!",,2022-12-22,2022-12-28 00:00:00,notizia imprecisa,it,facta.news,mixture
"L'area della piattaforma di ghiaccio Antartica dal 2009 al 2019 è cresciuta di 5.300 km quadrati testimoniano dati satellitari. Dov’è, allora, il riscaldamento globale?",,2023-07-18,2023-07-21 00:00:00,fuori contesto,it,facta.news,mostly false
«Bandiera della Federazione Russa sul municipio di Karkov».,,2022-02-24,2022-02-24 00:00:00,fuori contesto,it,facta.news,mostly false
«Rifugiati Ucraini in Spagna... Ma non sono Nazisti.. No!»,,2022-05-01,2022-05-04 00:00:00,fuori contesto,it,facta.news,mostly false
Il Presidente Bush è morto in diretta tv per essere sostituito da un clone?,,2022-09-08,2022-09-09 00:00:00,fuori contesto,it,facta.news,mostly false
Iran 2022 L'amore di un padre per un figlia. Aveva promesso che avrebbe ballato al suo matrimonio. Ma i soldati iraniani non l'hanno permesso. Barbaramente fucilata per aver partecipato alle manifestazioni in piazza in favore di Mahsa. Balla sulla sua tomba,,2022-09-28,2022-10-06 00:00:00,fuori contesto,it,facta.news,mostly false
«Un caccia russo abbattuto dalla contraerea ucraina»,,2022-02-24,2022-02-25 00:00:00,fuori contesto,it,facta.news,mostly false
"«Malak AL-Tanany 3 anni, il suo nome significa angelo. Malak è stata uccisa a Gaza dalle bombe israeliane. Malak è una dei tanti bambini che stanno pagando con il loro sangue una guerra infinita»",,2021-05-17,2021-05-20 00:00:00,fuori contesto,it,facta.news,mostly false
Il video con gli infermieri che mostrano letti vuoti in ospedale,,2021-04-23,2021-04-30 00:00:00,fuori contesto,it,facta.news,mostly false
«Il giorno che riuscirete a tenere il peso di un corpo con 2 dita vi invito a cena…e pago io!!»,,2022-05-09,2022-05-09 00:00:00,fuori contesto,it,facta.news,mostly false
"«È GIUSTO CHE VI VENGA TOLTA LA POSSIBILITÀ DI AVERE UNA CASA. La delirante teoria di Mario Monti, secondo la quale chi possiede una casa di proprietà non investe nell'istruzione dei figli, ma va oltre. La casa di proprietà rappresenta un problema per la mobilità del mercato impedendo ai giovani si spostarsi»",,2021-02-16,2021-02-16 00:00:00,fuori contesto,it,facta.news,mostly false
L'atrio del CERN; Niente di demoniaco da vedere qui… Spostati per favore,,2023-03-31,2023-04-21 00:00:00,fuori contesto,it,facta.news,mostly false
Qui si discuteva del recovery fund…non vedo ne Draghi ne Berlusconi,,2022-09-01,2022-09-01 00:00:00,fuori contesto,it,facta.news,mostly false
Il riso è fatto con amido di patate e plastica,,2023-10-18,2023-10-24 00:00:00,senza prove,it,facta.news,mostly false
Un enorme convoglio di veicoli che trasportano aiuti umanitari per i palestinesi si è riunito al valico di Rafah sul lato egiziano del confine con Gaza. Stanno aspettando il permesso di attraversare,,2023-10-15,2023-10-18 00:00:00,fuori contesto,it,facta.news,mostly false
Questa «strana luce» è stata vista in Turchia poco prima del terremoto,,2023-02-08,2023-02-10 00:00:00,fuori contesto,it,facta.news,mostly false
"Qualcuno può controllare cosa sta succedendo a Kiev, per l'amor di Dio?",,2023-04-20,2023-04-24 00:00:00,fuori contesto,it,facta.news,mostly false
Le foto di Joe Biden che abbraccia e bacia minori,,2020-11-08,2020-11-11 00:00:00,fuori contesto,it,facta.news,mostly false
"La moglie dI Zelensky va a Parigi e chiede l’elemosina per denaro e beni, poi, secondo quanto riferito,fa acquisti folli per 40.000€.Il negozio e' sull' Avenue Montaigne Riferiscono gli impiegati disgustati,senza però tenere conto del diritto innato all'eleganza sul jet privato",,2022-12-19,2022-12-20 00:00:00,immagine modificata,it,facta.news,mostly false
"In Nuova Zelanda opporsi alle politiche dei governi, comprese le misure Covid, è un segno che sei un terrorista.",,2022-11-03,2022-11-09 00:00:00,fuori contesto,it,facta.news,mostly false
GERMANIA. Video della detenzione da parte della polizia di una rifugiata ucraina in Germania.,,2022-07-14,2022-07-20 00:00:00,fuori contesto,it,facta.news,mostly false
Questi sono carri armati statunitensi Abrams su un treno in Polonia,,2023-01-26,2023-01-27 00:00:00,fuori contesto,it,facta.news,mostly false
Questa chiesa è bruciata mentre si celebrava un matrimonio tra persone delle stesso sesso,,2023-06-09,2023-06-16 00:00:00,fuori contesto,it,facta.news,mostly false
«In Arizona sono state accettate oltre 20 mila schede elettorali il giorno dopo le elezioni presidenziali del 2020»,,2022-06-05,2022-06-08 00:00:00,fuori contesto,it,facta.news,mostly false
"«Patricia Chandler, volontaria al trial per il vaccino Pfizer, rischia che le siano amputati i piedi»",,2020-12-25,2020-12-11 00:00:00,fuori contesto,it,facta.news,mostly false
"Whistleblower dalla casa di cura di Berlino: i terribili decessi dopo la vaccinazione Per la prima volta, c'è un rapporto di un testimone oculare di una casa di cura di Berlino sulla situazione dopo la vaccinazione. Proviene dalla casa di riposo AGAPLESION Bethanien Havelgarten a Berlino-Spandau. Lì, entro quattro settimane dalla prima vaccinazione con il vaccino BioNTech / Pfizer Comirnaty, otto dei 31 anziani, che soffrivano di demenza ma erano in buone condizioni fisiche in base alla loro età prima della vaccinazione, sono morti. La prima morte è avvenuta dopo soli sei giorni e altri cinque anziani sono morti circa 14 giorni dopo la vaccinazione. I primi sintomi della malattia erano già comparsi poco dopo la vaccinazione. Dalle informazioni disponibili a 2020News i pazienti non sono stati debitamente informati sui rischi di questo vaccino. L'avvocato Viviane Fischer e l'avvocato Dr.Reiner Füllmich del Comitato Corona hanno parlato in una videointervista con l'informatore sulle circostanze più vicine della vaccinazione, i sintomi che si sono verificati e la diversa natura dei decessi in connessione temporale con la vaccinazione "".",,2021-03-09,2021-03-09 00:00:00,fuori contesto,it,facta.news,mostly false
"«Los Angeles, California - Una regolare giornata di traffico sull’autostrada»",,2021-04-11,2021-04-26 00:00:00,immagine modificata,it,facta.news,mostly false
Questi non sono migranti «appena sbarcati» in Italia,,2022-06-19,2022-06-20 00:00:00,fuori contesto,it,facta.news,mostly false
Una compagnia telefonica ucraina ha rivelato che in Ucraina sono morti 400mila soldati,,2023-08-29,2023-09-04 00:00:00,senza prove,it,facta.news,mostly false
"L'inviato in Ucraina della BBC, Jeremy Bowen, mentre finge di essere sotto attacco davanti allo sguardo perplesso di una donna con le buste della spesa",,2022-10-05,2022-10-06 00:00:00,fuori contesto,it,facta.news,mostly false
Le oltre 39 mila segnalazioni legate ai vaccini anti-Covid sono eventi avversi tra i minori in Europa,,2022-09-26,2022-09-27 00:00:00,fuori contesto,it,facta.news,mostly false
"«Giudico uno scandalo, ad esempio, che ci siano più di un milione di dosi di vaccini non utilizzate»",Matteo Renzi,2021-03-02,2021-03-02 00:00:00,ceri quasi,it,pagellapolitica.it,mostly true
"«A volte penso che in Regione Piemonte siano bipolari. Chiedono pubblicamente l’aiuto dei medici delle Ong, ma vietano di partecipare ai concorsi di emergenza per gli ospedali ai cittadini extraeuropei»

",Chiara Gribaudo,2020-11-10,2020-11-13 00:00:00,ceri quasi,it,pagellapolitica.it,mostly true
«La nota di aggiornamento dell’agenda Draghi riporta la spesa per la sanità pubblica sotto il livello del 2019» ,Stefano Fassina,2021-10-01,2021-10-01 00:00:00,ceri quasi,it,pagellapolitica.it,mostly true
Bankitalia ha 7.000 dipendenti con uno stipendio medio di 85 mila euro all’anno,Matteo Salvini,2019-02-19,2019-03-06 00:00:00,ceri quasi,it,pagellapolitica.it,mostly true
"«Il trasporto su ferro riduce di 5 volte le emissioni di CO2 rispetto alla gomma»

",Alberto Zolezzi,2020-10-12,2020-10-13 00:00:00,ceri quasi,it,pagellapolitica.it,mostly true
"Lega e 5 Stelle hanno paura di dire la verità agli Italiani. C’è uno che la dice, ed è il ministro Tria, che ha già detto che aumenterà l'Iva",Nicola Zingaretti,2019-05-21,2019-05-23 00:00:00,ceri quasi,it,pagellapolitica.it,mostly true
L’Unione Europea ha detto che potrebbe toglierci i soldi della Tav. E Toninelli ha risposto all’UE: qui c'è un Governo sovrano che decide. Falso. Non decide il Governo sulla Tav: decide il Parlamento,Matteo Renzi,2019-02-04,2019-02-06 00:00:00,ceri quasi,it,pagellapolitica.it,mostly true
Approvato ora in Consiglio dei Ministri il decreto immigrazione. I decreti propaganda/Salvini non ci sono più. Vogliamo un’Italia  più umana e sicura. Un’Europa più protagonista,Nicola Zingaretti,2020-10-05,2020-10-08 00:00:00,tendenzialmente vero,it,lavoce.info,mostly true
"«A gennaio 2021 l’export italiano segna +2,3% congiunturale con + 1 mld di saldo commerciale rispetto a gennaio 2020. Tra le grandi economie, esclusa la Cina, l’Italia è quella che ha maggiormente contenuto il calo dell'export»
",Manlio Di Stefano,2021-02-22,2021-03-30 00:00:00,ceri quasi,it,pagellapolitica.it,mostly true
«Oggi l'incidenza dell'obesità in Italia tra i ragazzi fino a 12 anni è superiore alla media dell'Unione europea»,Roberto Gualtieri,2019-11-03,2019-11-06 00:00:00,ceri quasi,it,pagellapolitica.it,mostly true
"«Ci sono 260 mila studenti disabili nelle scuole italiane, e ci sono solo 150 mila insegnanti di sostegno, di cui 50 mila precari [...] Gli insegnanti precari, sia di sostegno che delle altre scuole italiane, [...] sono 200 mila» (min. -1:11:55)
",Matteo Salvini,2020-06-11,2020-06-18 00:00:00,ceri quasi,it,pagellapolitica.it,mostly true
"«Per la prima volta negli ultimi quattro anni in Italia la povertà assoluta è diminuita. Un risultato reso possibile dall’introduzione nel nostro Paese del reddito di cittadinanza»

",Vito Crimi,2020-06-16,2020-06-17 00:00:00,ceri quasi,it,pagellapolitica.it,mostly true
"Il 65 per cento dei nostri connazionali all’estero sono emigrati dall’Italia, quindi è prima emigrazione […]. Sull’esame di lingua [per diventare cittadini italiani], […] il test di lingua di italiano livello B1 che è stato introdotto dal governo, questo prima non c’era.",Guglielmo Picchi,2019-03-27,2019-04-02 00:00:00,ceri quasi,it,pagellapolitica.it,mostly true
"«Gli altri Paesi hanno meno interesse di noi al Mes perché hanno un debito meno elevato e possono attivare prestiti alternativi sui mercati a tassi bassi come quelli del Mes. Noi no»

",Enrico Letta,2020-07-01,2020-07-08 00:00:00,ceri quasi,it,pagellapolitica.it,mostly true
"Il tasso di evasione scolastica è del 14,5 per cento, un dato drammatico che aumenta di un punto l'anno",Nicola Zingaretti,2019-05-15,2019-05-21 00:00:00,ceri quasi,it,pagellapolitica.it,mostly true
"L’anno scorso, circa il 40 per cento delle nostre importazioni di gas è venuto dalla Russia. Oggi, in media, è circa la metà.",Mario Draghi,2022-08-24,2022-09-06 00:00:00,tendenzialmente vero,it,lavoce.info,mostly true
"«I 27,4 mld dello Sure funzionano esattamente come i 35 mld del Pandemic Crisis Support [...], con la differenza che i primi sono condizionati ad un utilizzo per il lavoro, i secondi per la sanità. Per il resto sono assolutamente identici»",Luigi Marattin,2020-08-24,2020-08-26 00:00:00,ceri quasi,it,pagellapolitica.it,mostly true
"«L’hanno fatto Spagna e Belgio [di proporre un contributo di solidarietà, ndr]»

",Laura Boldrini,2020-11-30,2020-12-01 00:00:00,ceri quasi,it,pagellapolitica.it,mostly true
